aid,title,reason
625533,discretionary disclosure in financial reporting an examination comparing internal firm data to externally reported segment data,No citations
654387,is us multinational dividend repatriation policy influenced by reporting incentives,No citations
284572,estimating the hidden costs of environmental regulation,No citations
350306,integrated longitudinal employer-employee data for the united states,No citations
961344,"the rise of the gig economy fact """"or"""" fiction",No citations
133650,"SCIENCE, RESEARCH-AND-DEVELOPMENT, AND INVENTION POTENTIAL RECHARGE - UNITED-STATES EVIDENCE",No citations
589994,long-term consequences of vietnam-era conscription new estimates using social security data,No citations
874946,concentrating on the fall of the labor share,No citations
350305,"using ""insider econometrics"" to study productivity",No citations
874932,the expanding gender earnings gap evidence from the lehd 2000 census,No citations
177172,do preferential procurement programs benefit minority business,No citations
233007,examining the employer-size wage premium in the manufacturing retail trade and service industries using employer-employee matched data,No citations
506483,the margins of us trade,No citations
545797,intrafirm trade and product contractibility,No citations
545790,wholesalers and retailers in us trade,No citations
777289,factoryless goods producing firms,No citations
828091,the rapid adoption of data driven decision making,No citations
828128,stem training and early career outcomes of female and male graduate students evidence from umetrics data linked to the 2010 census,No citations
589997,the war at home effects of vietnam era military service on postwar household stability,No citations
634686,recruiting intensity during and after the great recession national and industry evidence,No citations
828104,declining business dynamism what we know and the way forward,No citations
874975,declining dynamism allocative efficiency and the productivity slowdown,No citations
828107,the role of startups in structural transformation,No citations
828083,firm level dispersion in productivity is the devil in the details,No citations
917513,challenges in the measurement of leakage risk,No citations
874982,job to job flows and earnings growth,No citations
233006,productivity differences across employers  the roles of employer size age and human capital,No citations
120423,the toxic intensity of industrial production  global patterns trends and trade policy,No citations
634685,job to job flows in the great recession,No citations
828113,evolution of the marriage earnings gap for women,No citations
680140,immigration and employer transitions for stem workers,No citations
160801,capital structure and product market rivalry  how do we reconcile theory and evidence,No citations
634684,hiring churn and the business cycle,Not in WOS or Misspelling
917515,regulating mismeasured pollution implications of firm heterogeneity for environmental policy,No citations
961339,four years later insurance coverage and access to care continue to diverge between aca medicaid expansion and non expansion states,No citations
874987,the role of firms in gender earnings inequality evidence from the united states,No citations
590015,environmental regulation and labor reallocation evidence from the clean air act,No citations
503349,mergers and acquisitions employment wages and plant closures in the us meat product industries,No citations
213136,innovation and regulation in the pesticide industry,No citations
760757,direct payments cash rents land values and the effects of imputation in us farm level data,Not in WOS or Misspelling
585982,schooling and the vietnam era gi bill evidence from the draft lottery,No citations
631695,reexamining the impact of family planning programs on us fertility evidence from the war on poverty and the early years of title x,No citations
637382,the opt in revolution contraception and the gender gap in wages,No citations
637373,raising the barcode scanner technology and productivity in the retail sector,No citations
502918,the effect of alcohol consumption on mortality regression discontinuity evidence from the minimum drinking age,No citations
547950,us environmental regulation and fdi evidence from a panel of us based multinational firms,No citations
956116,using linked survey and administrative data to better measure income implications for poverty program effectiveness and holes in the safety net,No citations
872339,signing up new fathers do paternity establishment initiatives increase marriage parental investment and child wellbeing,No citations
839188,does early life exposure to cigarette smoke permanently harm childhood welfare evidence from cigarette tax hikes,No citations
937003,supply side drug policy in the presence of substitutes evidence from the introduction of abuse deterrent opioids,No citations
650448,framing social security reform behavioral responses to changes in the full retirement age,No citations
727886,the differential effects of bilateral tax treaties,No citations
502929,domestic effects of the foreign activities of us multinationals,No citations
604878,medicare part d and the financial protection of the elderly,No citations
630426,inertia and over withholding explaining the prevalence of income tax refunds,No citations
975300,randomized safety inspections and risk exposure on the job quasi experimental estimates of the value of a statistical life,No citations
878784,how much can expanding access to long acting reversible contraceptives reduce teen birth rates,No citations
958680,correcting for misreporting of government benefits,No citations
885542,how important are sectoral shocks,No citations
543968,business volatility job destruction and unemployment,No citations
823181,market exposure and endogenous firm volatility over the business cycle,No citations
956564,reconsidering the consequences of worker displacements firm versus worker perspective,No citations
914893,cyclical job ladders by firm size and firm wage,No citations
872349,the effects of the real oil price on regional wage dispersion,No citations
680088,"testing for factor price equality with unobserved differences in factor quality """"or"""" productivity",No citations
744968,mergers and sunk costs an application to the ready mix concrete industry,No citations
953095,an economic analysis of privacy protection and statistical accuracy as social choices,No citations
634715,taxes cigarette consumption and smoking intensity comment,No citations
936372,innovation reallocation and growth,No citations
966679,missing growth from creative destruction,No citations
881732,the margins of global sourcing theory and evidence from us firms,No citations
927407,innovation and production in the global economy,No citations
726468,vertical integration and input flows,No citations
331858,plants and productivity in international trade,No citations
542499,multiple product firms and product switching,No citations
734598,patent laws product life cycle lengths and multinational activity,No citations
647364,reset price inflation and the impact of monetary policy shocks,No citations
297313,the impact of economic conditions on participation in disability programs evidence from the coal boom and bust,No citations
959457,what drives differences in management practices,No citations
198505,an empirical assessment of the proximity concentration trade off between multinational sales and trade,No citations
678383,assessing the incidence and efficiency of a prominent place based policy,No citations
192422,aggregate employment dynamics  building from microeconomic evidence,No citations
775202,reallocation and technology evidence from the us steel industry,No citations
133654,the aggregate implications of machine replacement  theory and evidence,No citations
238985,machine replacement and the business cycle  lumps and bumps,No citations
775262,environmental health risks and housing values evidence from 1 600 toxic plant openings and closings,No citations
747046,private equity jobs and productivity,No citations
631720,information and industry dynamics,No citations
547984,what causes industry agglomeration evidence from coagglomeration patterns,No citations
413932,accounting for the growth of mnc based trade using a structural model of us mncs,No citations
465489,"reallocation firm turnover and efficiency selection on productivity """"or"""" profitability",No citations
676526,the impact of medical liability standards on regional variations in physician behavior evidence from the adoption of national standard rules,No citations
972754,firms internal networks and local economic shocks,No citations
345820,export versus fdi with heterogeneous firms,No citations
180475,effects of air quality regulation,No citations
595584,the impact of regulations on the supply and quality of care in child care markets,No citations
682237,the gravity of knowledge,No citations
350366,workers education spillovers and productivity evidence from plant-level production functions,No citations
830691,the surprisingly swift decline of us manufacturing employment,No citations
940198,why is pollution from us manufacturing declining the roles of environmental regulation productivity and trade,No citations
839215,what can we learn about the effects of food stamps on obesity in the presence of misreporting,No citations
254192,no such thing as a free safe lunch the cost of food safety regulation in the meat industry,No citations
418484,supermarket human resource practices and competition from mass merchandisers,Not in WOS or Misspelling
878817,food and agricultural industries opportunities for improving measurement and reporting,No citations
217222,rural manufacturing on the crest of the wave a count data analysis of technology use,No citations
186181,structural change in meat industries implications for food safety regulation,No citations
254194,scale economies and consolidation in hog slaughter,No citations
287286,scale economies and consolidation in hog slaughter reply,No citations
382819,technology labor wars and producer dynamics explaining consolidation in beef packing,No citations
369218,technological change and economies of scale in us poultry processing,No citations
410782,mergers and acquisitions and productivity in the us meat products industries evidence from the micro data,No citations
842641,employers changing economic incentives to offer health insurance under the affordable care act,No citations
960595,short run effects of parental job loss on child health,No citations
878828,second trimester sunlight and asthma evidence from two independent studies,Not in WOS or Misspelling
177261,employer size and the wage structure in us manufacturing,Not in WOS or Misspelling
339705,ethnicity language and workplace segregation evidence from a new matched employer employee data set,Not in WOS or Misspelling
578780,spatial mismatch immigrant networks and hispanic employment in the united states,Not in WOS or Misspelling
177254,using longitudinal data on establishments to analyze the effects of unio* *ganizing campaigns in the united states,Not in WOS or Misspelling
924203,sorting between and within industries a testable model of assortative matching,Not in WOS or Misspelling
983557,a spatial model of growth relationships and latino owned business,No citations
444081,access to financial capital among us businesses the case of african american firms,No citations
654481,the empirics of firm heterogeneity and international trade,No citations
781390,"productivity """"or"""" demand determinants of plant survival and ownership change in the us poultry industry",No citations
611026,lost jobs and health insurance an analysis of the impact of employment volatility on firm provided health insurance,No citations
566432,information and credit access using bankruptcy as a signal,No citations
468994,parent child bargaining parental transfers and the post secondary education decision,No citations
891394,do volatile firms pay volatile earnings evidence from linked worker firm data,No citations
587551,employer health benefit costs and demand for part time labour,No citations
958141,examining the long term mortality effects of early health shocks,No citations
747120,economic burden and disparities in healthcare resource use among adult patients with cardiac arrhythmia,No citations
666380,recent trends in earnings volatility evidence from survey and administrative data,No citations
571685,heterogeneity and learning in labor markets,No citations
605351,the labor supply consequences of employment limiting social insurance benefits new tests for income effects,No citations
544091,what kind of job is safer a note on occupational vulnerability,No citations
504108,environmental products manufacturing a look inside the green industry,No citations
984226,the effects of occupational licensing evidence from business level data,No citations
703923,fifty years of family planning new evidence on the long run effects of increasing access to contraception,No citations
122693,productivity dynamics in manufacturing plants,No citations
171694,exporters jobs and wages in us manufacturing  1976 1987,No citations
171677,plant level adjustment and aggregate investment dynamics,No citations
110377,wage dispersion between and within us manufacturing plants 1963 86,No citations
104090,the cyclical behavior of the gross flows of us workers comments,Not in WOS or Misspelling
842866,understanding declining fluidity in the us labor market,No citations
104091,the cyclical behavior of the gross flows of us workers comments,Not in WOS or Misspelling
216133,patterns of advanced technology adoption and manufacturing performance,Not in WOS or Misspelling
307736,race and gender differences in business ownership and business turnover,Not in WOS or Misspelling
146825,small business and job creation  dissecting the myth and reassessing the facts,No citations
3650,segmentation in the us labour market its effects on the mobility and earnings of whites and blacks,No citations
634892,markets and the non monotonic relation between productivity and establishment size,No citations
223175,trade liberalization and delocalization new evidence from firm level panel data,No citations
885758,food and beverage television advertising exposure and youth consumption body mass index and adiposity outcomes viewpoint,Not in WOS or Misspelling
517716,tariff effects on mnc decisions to engage in intra firm and arms length trade,No citations
813053,product quality and firm heterogeneity in international trade,No citations
233166,information technology and its impact on productivity firm level evidence from government and private data sources 1977 1993,No citations
200915,technology and jobs secular changes and cyclical dynamics,No citations
922977,conflicting transfer pricing incentives and the role of coordination,No citations
728305,"a warm embrace """"or"""" the cold shoulder wage and employment outcomes in ethnic enclaves",No citations
966757,race matters income shares income inequality and income mobility for all us races,No citations
901820,second generation outcomes of the great migration,No citations
752436,workplace concentration of immigrants,No citations
960055,educational disparities in adult mortality across us states how do they differ and have they changed since the mid 1980s,No citations
826373,joining leaving and staying in the american indian/alaska native race category between 2000 and 2010,No citations
901810,the methuselah effect the pernicious impact of unreported deaths on old age mortality estimates,No citations
737733,residential mobility across local areas in the united states and the geographic distribution of the healthy population,No citations
969955,predicting the effect of adding a citizenship question to the 2020 census,No citations
347449,self care why do parents leave their children unsupervised,No citations
642931,the long term effects of military conscription on mortality estimates from the vietnam era draft lottery,No citations
796867,the long term health implications of marital disruption divorce work limits and social security disability benefits among men,No citations
680688,gender and the neighborhood location of mixed race couples,No citations
875301,america s churning races race and ethnicity response changes between census 2000 and the 2010 census,No citations
711623,the effect of school quality on black white health differences evidence from segregated southern schools,No citations
737732,the location of displaced new orleans residents in the year after hurricane katrina,No citations
656582,segregation through the lens of housing unit transition what roles do the prior residents the local micro neighborhood and the broader neighborhood play,No citations
937701,cigarette smoking and all cause and cause specific adult mortality in the united states,No citations
942953,interstate migration and employer to employer transitions in the united states new evidence from administrative records data,No citations
329154,why poverty remains high the role of income growth economic inequality and changes in family structure 1949 1999,No citations
737747,more than one million new american indians in 2000 who are they,No citations
875315,job changing and the decline in long distance migration in the united states,No citations
347445,welfare reform and female headship,No citations
954936,the timing of teenage births estimating the effect on high school graduation and later life outcomes,No citations
611320,local environmental regulation and plant level productivity,No citations
381273,pollution abatement expenditures and plant level productivity a production function approach,No citations
701358,amenity values of proximity to national wildlife refuges an analysis of urban residential property values,No citations
231315,grandfather regulations new source bias and state air toxics regulations,No citations
777488,pollution havens and the trade in toxic chemicals evidence from us trade flows,No citations
966768,understanding the micro determinants of defensive behaviors against pollution,No citations
930572,really uncertain business cycles,No citations
688648,demand fluctuations in the ready mix concrete industry,No citations
982497,how destructive is innovation,No citations
183089,the dynamics of productivity in the telecommunications equipment industry,No citations
919062,evaluating the impact of manufacturing extension services on establishment performance,No citations
479346,crimes impact on the survival prospects of young urban small businesses,No citations
466699,participation in export markets and productivity of plants in los angeles 19871997,Not in WOS or Misspelling
879142,urban immigrant diversity and inclusive institutions,No citations
605692,regional industrial structure concentration in the united states trends and implications,No citations
444493,geography and the immigrant division of labor,No citations
92729,export performance and state industrial growth,No citations
352154,regional income inequality and international trade,No citations
347536,access to work the effects of spatial and social accessibility on unemployment for native born black and immigrant women in los angeles,No citations
868209,using the pareto distribution to improve estimates of topcoded earnings,No citations
376636,it and productivity in us manufacturing do computer networks matter,No citations
726658,surviving credit market competition,No citations
711799,parental earnings and children s well being an analysis of the survey of income and program participation matched to social security administration earnings data,No citations
174807,estimating capital efficiency schedules within production functions,No citations
984220,multiregional firms and region switching in the us manufacturing sector,No citations
868198,intellectual property protection and the industrial composition of multinational activity,No citations
106954,the impact of r&d investment on productivity new evidence using linked r&d lrd data,No citations
511607,reaching for the stars who pays for talent in innovative industries,No citations
442011,does employment protection reduce productivity evidence from us states,No citations
344886,whats driving the new economy the benefits of workplace innovation,No citations
486779,energy prices and the adoption of energy saving technology,No citations
48499,effects of worker attitudes on production costs and the value of capital input,No citations
920277,is regulation to blame for the decline in american entrepreneurship,No citations
376659,technological evolution as creative destruction of process heterogeneity evidence from us plant level data,Not in WOS or Misspelling
159997,wages employment structure and employer size wage premia their relationship to advanced technology usage at us manufacturing establishments,No citations
826492,the slow growth of new plants learning about demand,No citations
431709,the dynamics of worker reallocation within and across industries,No citations
726670,food prices and body fatness among youths,No citations
559762,improving imputations of top incomes in the public use current population survey by using both cell means and variances,No citations
280291,gross employment flows in us coal mining,No citations
651269,evaluating estimates of materials offshoring from us manufacturing,No citations
300481,immigrant status race and institutional choice in higher education,No citations
921441,are states winning the fight evidence on the impact of state laws on bullying in schools,No citations
224353,the effect of technology use on productivity growth,Not in WOS or Misspelling
353675,information technology investment and firm performance in us retail trade,Not in WOS or Misspelling
307952,an option value approach to technology adoption in us manufacturing evidence from microdata,Not in WOS or Misspelling
692782,linking investment spikes and productivity growth,No citations
969229,measuring plant level energy efficiency and technical change in the us metal based durable manufacturing sector using stochastic frontier analysis,No citations
469547,estimating plant level energy efficiency with a stochastic frontier,No citations
974258,the impacts of lower natural gas prices on jobs in the us manufacturing sector,No citations
896717,creating linked datasets for sme energy assessment evidence building results from the us industrial assessment center program,No citations
616394,the performance of industrial sector voluntary climate programs climate wise and 1605(b),No citations
831400,taxation corruption and growth,No citations
230280,spatial evolution of the computer industry in the usa,No citations
962891,host country financial development and multinational activity,No citations
831399,where has all the skewness gone the decline in high growth (young) firms in the us,No citations
915310,the rise of exporting by us firms,No citations
984263,entry and exit of manufacturing plants over the business cycle,No citations
179414,output price markups and producer size,No citations
693043,offshoring wages and employment theory and evidence,No citations
788168,the paradox of progress the emergence of wage discrimination in us manufacturing,No citations
490626,professional employer organizations what are they who uses them and why should we care,Not in WOS or Misspelling
758937,black white differences in intergenerational economic mobility in the united states,Not in WOS or Misspelling
439788,dividend policy inside the multinational firm,No citations
784944,associations between soda prices and intake evidence from 24 h dietary recall data,No citations
685689,industrial structure and the sources of agglomeration economies evidence from manufacturing plant production,No citations
142007,the influence of location on productivity  manufacturing technology in rural and urban areas,No citations
474605,international trade and the changing demand for skilled workers in high tech manufacturing,No citations
590578,"does procedure profitability impact whether an outpatient surgery is performed at an ambulatory surgery center """"or"""" hospital",No citations
657243,health service use among the previously uninsured is subsidized health insurance enough,No citations
782318,nonlinear effects of soda taxes on consumption and weight outcomes,No citations
831705,copayments and emergency department use among adult medicaid enrollees,No citations
974439,how do economic downturns affect the mental health of children evidence from the national health interview survey,No citations
875863,heterogeneity in smokers responses to tobacco control policies,No citations
701875,the effect of medical malpractice liability on rate of referrals received by specialist physicians,No citations
961840,the consequences of long term unemployment evidence from linked survey and administrative data,No citations
813242,impacts of unionization on quality and productivity regression discontinuity evidence from nursing homes,No citations
879645,what businesses attract unions unionization over the life cycle of us establishments,No citations
979541,measuring job creation growth and survival among the universe of startups in the united states using a combined startup panel data set,No citations
938562,the poverty reduction of social security and means tested transfers,No citations
704497,how firms respond to business cycles the role of firm age and firm size,No citations
984229,the great recession and a missing generation of exporters,No citations
981478,startups job creation and founder characteristics,No citations
201795,firm performance and evolution  empirical regularities in the us microdata,Not in WOS or Misspelling
218927,beyond the incidence of employer provided training,No citations
590645,labor market rigidities and the employment behavior of older workers,No citations
