aid,title,reason
867316,selection and specialization in the evolution of marriage earnings gaps,Not in WOS or Misspelling
531127,products and productivity,No citations
371468,the winners curse of human capital,No citations
182833,"downsizing and productivity growth  myth """"or"""" reality",No citations
351798,small north american producers give ground in the 1990s,No citations
170432,a comparison of franchise and independent small business survival rates,No citations
245360,exiting self employment an analysis of asian immigrant owned small businesses,Not in WOS or Misspelling
200714,counting the self employed using household and business sample data,No citations
529261,gender differences in business performance evidence from the characteristics of business owners survey,No citations
326852,redefining business success distinguishing between closure and failure,No citations
303321,returns to scale in small and large us manufacturing establishments further evidence,No citations
984228,returns to scale in small and large us manufacturing establishments,No citations
131681,factor substitution in small and large us manufacturing establishments  197782,Not in WOS or Misspelling
232452,factor substitution in us manufacturing  does plant size matter,No citations
232451,the demography of business closings,No citations
777042,transnational activities of immigrant owned firms and their performances in the usa,No citations
820810,suicide in the city do characteristics of place really influence risk,No citations
351832,fertility changes among immigrants generations neighborhoods and personal characteristics,No citations
810793,the relationship between state welfare rules and economic disconnection among low income single mothers,No citations
869112,the impact of the acas extension of coverage to dependents on young adults access to care and prescription drugs,Not in WOS or Misspelling
757933,levels and trends in us income and its distribution a crosswalk from market income towards a comprehensive haigsimons income approach,Not in WOS or Misspelling
138430,decomposing technical change,No citations
944772,when it rains it pours under what circumstances does job loss lead to divorce,No citations
940674,effect of stress on later life health evidence from the vietnam war draft,No citations
109975,a note on ownership and performance in manufacturing firms,No citations
146233,unionism and gross employment flows,No citations
343456,the impact of minimum wages on job training an empirical exploration with establishment data,No citations
370157,transitions from welfare and the employment prospects of low skill workers,No citations
983516,how do local labor markets and human capital affect employment outcomes after job loss,No citations
744607,synthetic establishment data origins and introduction to current research,Not in WOS or Misspelling
931247,assimilation and coverage of the foreign born population in administrative records,Not in WOS or Misspelling
744611,a first step towards a german synlbd constructing a german longitudinal business database,Not in WOS or Misspelling
931246,when race and hispanic origin reporting are discrepant across administrative records and third party sources exploring methods to assign responses,Not in WOS or Misspelling
948670,evaluating race and hispanic origin responses of medicaid participants using census data,Not in WOS or Misspelling
744608,expanding the role of synthetic data at the us census bureau,Not in WOS or Misspelling
744609,looking back on three years of using the synthetic lbd beta,Not in WOS or Misspelling
827880,using partially synthetic microdata to protect sensitive cells in business statistics,Not in WOS or Misspelling
595232,structural change and industrial classification,Not in WOS or Misspelling
984219,earnings inequality and coordination costs evidence from us law firms,Not in WOS or Misspelling
339113,what determines environmental performance at paper mills the roles of abatement spending regulation and efficiency,Not in WOS or Misspelling
312025,tracing the sources of local external economies,No citations
715087,"why do higher income households choose low income neighbourhoods pioneering """"or"""" thrift",No citations
359203,the impact of violence surges on neighbourhood business activity,No citations
568710,"what is the ""neighbourhood"" in neighbourhood satisfaction comparing the effects of structural characteristics measured at the micro neighbourhood and tract levels",No citations
238897,multinationals production efficiency and spillover effects the case of the us auto parts industry,No citations
202727,formal and informal regulation of industrial pollution comparative evidence from indonesia and the united states,No citations
504007,factor prices factor substitution and exporting in us manufacturing affiliates abroad,No citations
818813,cheap imports and the loss of us manufacturing jobs,No citations
787217,origin of foreign direct investment and firm performance evidence from foreign acquisitions of chinese domestic firms,No citations
984119,trade liberalisation and labour shares in china,No citations
