aid,title,reason
279018,do high performance work practices improve establishment level outcomes,No citations
465271,are franchises bad employers,No citations
211845,sex segregation in us manufacturing,No citations
431070,families human capital and small business evidence from the characteristics of business owners survey,No citations
375492,the declining effects of osha inspections on manufacturing injuries 1979 1998,No citations
349230,escaping low earnings the role of employer characteristics and changes,No citations
49319,worker attitudes worker behavior and productivity in the us automobile industry 1959 1976,No citations
740788,offshoring and the polarization of the us labor market,No citations
652162,decomposing the sources of earnings inequality assessing the role of reallocation,No citations
343965,how workers fare when employers innovate,No citations
346375,why do employers retrain at risk workers the role of social capital,No citations
970974,vulnerable jobs and the wage effects of import competition,No citations
372031,the last american shoe manufacturers decreasing productivity and increasing profits in the shift from piece rates to continuous flow production,No citations
433274,"us multinational activity abroad and us jobs substitutes """"or"""" complements",No citations
685819,manufacturing plants use of temporary workers an analysis using census microdata,No citations
834140,firm level monopsony and the gender pay gap,No citations
302429,silicon mountains silicon molehills geographic concentration and convergence of internet industries in the us,No citations
419526,unstable inferences an examination of complex survey sample design adjustments using the current population survey for health services research,No citations
385745,the effect of schip expansions on health insurance decisions by employers,No citations
494643,does managed care improve access to care for medicaid beneficiaries with disabilities a national study,No citations
453690,individual health insurance within the family can subsidies promote family coverage,No citations
937973,medicaid and the labor supply of single mothers implications for health care reform,No citations
877529,plant exit and us imports from low wage countries,Not in WOS or Misspelling
673556,the task composition of offshoring by us multinationals,Not in WOS or Misspelling
317685,employer offers private coverage and the tax subsidy for health insurance 1987 and 1996,Not in WOS or Misspelling
294595,employer contribution methods and health insurance premiums does managed competition work,Not in WOS or Misspelling
401228,employer choices of family premium sharing,Not in WOS or Misspelling
592931,premium growth and its effect on employer sponsored insurance,No citations
980378,the impact of medicaid expansion on employer provision of health insurance,No citations
886850,the availability and marginal costs of dependent employer sponsored health insurance,No citations
897150,the impact of health insurance expansion on physician treatment choice medicare part d and physician prescribing,No citations
756495,estimating the impact of low income universal service programs,No citations
929600,competition productivity and survival of grocery stores in the great depression,No citations
377023,exit from regional manufacturing markets the role of entrant experience,No citations
660363,strategic alliance as a response to the threat of entry evidence from airline codesharing,No citations
273958,the impact of ownership changes a view from labor markets,No citations
883538,the distributional consequences of preferential trade liberalization firm level evidence,No citations
803839,the influence of firm global supply chains and foreign currency undervaluations on us trade disputes,No citations
889840,winners and losers in international trade the effects on us presidential voting,No citations
406610,is there really an export wage premium a case study of los angeles using matched employee employer data,No citations
549172,tariffs versus anti dumping duties,No citations
375643,alcohol drugs and violent crime,No citations
670576,persistent interindustry wage differences rent sharing and opportunity costs,Not in WOS or Misspelling
718639,the plant lifecycle of the average wage of employees in us manufacturing,Not in WOS or Misspelling
718638,the recent decline in employment dynamics,Not in WOS or Misspelling
515613,measuring network effects on trade a reexamination,No citations
974630,made in the usa a study of firm responses to domestic production incentives,No citations
706790,location of decision rights within multinational firms,No citations
332817,neighbourhood effects and housing demand,No citations
877667,import competition from and offshoring to low income countries implications for employment and wages at us domestic manufacturers,No citations
373241,the sensitivity of economic statistics to coding errors in personal identifiers,No citations
966124,modeling endogenous mobility in earnings determination,No citations
440252,using worker flows to measure firm dynamics,No citations
628878,employer to employer flows in the united states estimates using linked employer employee data,No citations
364259,the measurement of medicaid coverage in the sipp evidence from a comparison of matched records,No citations
201239,on measuring segregation in samples with small units,No citations
772775,"multiple imputation of missing """"or"""" faulty values under linear constraints",No citations
179583,nonresponse bias and business turnover rates  the case of the characteristics of business owners survey,No citations
100298,small area estimation of economic statistics,No citations
159049,establishment microdata for economic research and policy analysis  looking beyond the aggregates,No citations
251193,the contribution of establishment births and deaths to employment growth,No citations
542039,it and beyond the contribution of heterogeneous capital to productivity,No citations
515753,the impact of hurricanes katrina rita and wilma on business establishments,Not in WOS or Misspelling
984221,who files for personal bankruptcy in the united states,No citations
902970,the relationship between the school breakfast program and food insecurity,No citations
981612,was television responsible for a new generation of smokers,No citations
745863,the effects of corporate spin offs on productivity,No citations
907848,career concerns and the busy life of the young ceo,No citations
593475,national estimates of gross employment and job flows from the quarterly workforce indicators with demographic and industry detail,No citations
351179,why do employers pay for college,No citations
467541,the work disincentive effects of the disability insurance program in the 1990s,No citations
897384,misclassification in binary choice models,No citations
390998,a change of pace comparing the 1994 and 1999 pollution abatement costs and expenditures surveys,Not in WOS or Misspelling
493258,consistent cell means for top coded incomes in the public use march cps (1976 2007),Not in WOS or Misspelling
268496,survey attrition considerations in the medical expenditure panel survey,Not in WOS or Misspelling
712747,occupation inflation in the current population survey,Not in WOS or Misspelling
911029,the annual survey of entrepreneurs,Not in WOS or Misspelling
753837,computer networks and productivity revisited does plant size matter evidence and implications,Not in WOS or Misspelling
412354,using census business data to augment the mepsic,Not in WOS or Misspelling
140123,manufacturing establishments reclassified into new industries the effect of survey design rules,Not in WOS or Misspelling
227747,the manufacturing plant ownership change database  its construction and usefulness,Not in WOS or Misspelling
493259,capital energy substitution revisited new evidence from micro data,Not in WOS or Misspelling
665832,a concordance between ten digit us harmonized system codes and sic/naics product classes and industries,Not in WOS or Misspelling
383771,hierarchical sorting and learning costs theory and evidence from the law,No citations
660669,learning about the nature of production from equilibrium assignment patterns,No citations
123815,industrial de diversification and its consequences for productivity,No citations
741197,the role of asset testing in public health insurance reform,No citations
941345,a model of entry exit and plant level dynamics over the business cycle,No citations
445159,initial conditions at emancipation the long run effect on black white wealth and earnings inequality,No citations
945376,taken by storm business financing and survival in the aftermath of hurricane katrina,No citations
922073,spillovers from immigrant diversity in cities,No citations
555006,clusters and entrepreneurship,No citations
306900,agglomeration economies and productivity differences in us cities,No citations
400422,technological variety technological change and a geography of production techniques,No citations
751119,railroad expansion and industrialization evidence from meiji japan,No citations
607328,estimating trends in us income inequality using the current population survey the importance of controlling for censoring,No citations
655277,the reverse wage gap among educated white and black women,No citations
736016,does the retirement consumption puzzle differ across the distribution,No citations
920720,global firms,No citations
442874,firms in international trade,No citations
729662,fluctuations in uncertainty,No citations
412469,the flow approach to labor markets new data sources and micro macro links,No citations
738617,the role of entrepreneurship in us job creation and economic dynamism,No citations
917816,new perspectives on the decline of us manufacturing employment,No citations
871949,the new life cycle of women s employment disappearing humps sagging middles expanding tops,No citations
588790,offshoring bias in us manufacturing,No citations
871950,specialization then and now marriage children and the gender earnings gap across cohorts,No citations
738618,entrepreneurship as experimentation,No citations
795435,household surveys in crisis,No citations
597062,internal migration in the united states,No citations
933182,economic policies with endogenous entry and exit of plants,Not in WOS or Misspelling
305963,the market for tornado safety analysis of applications to the oklahoma safe room initiative,Not in WOS or Misspelling
326465,startup financing owner characteristics and survival,Not in WOS or Misspelling
467703,analysis of young neighborhood firms serving urban minority clients,No citations
645091,"supersize it the growth of retail chains and the rise of the ""big box"" store",No citations
902985,customer employee substitution evidence from gasoline stations,No citations
759633,labor regulations and european venture capital,No citations
876219,taking the leap the determinants of entrepreneurs hiring their first employee,No citations
518951,local industrial conditions and entrepreneurship how much of the spatial distribution can we explain,No citations
934388,business dynamics of innovating firms linking us patents with administrative data on workers and firms,No citations
965233,brighter prospects assessing the franchise advantage using census data,No citations
736059,delegation in multi establishment firms evidence from it purchasing,Not in WOS or Misspelling
377256,air pollution abatement costs under the clean air act evidence from the pace survey,No citations
707056,do environmental regulations disproportionately affect small businesses evidence from the pollution abatement costs and expenditures survey,No citations
238244,the impact of environmental constraints on productivity improvement in integrated paper plants,No citations
751202,"evidence of an ""energy management gap"" in us manufacturing spillovers from firm management practices to energy efficiency",No citations
970321,when do environmental regulations backfire onsite industrial electricity generation energy efficiency and policy instruments,No citations
887156,the effect of environmental regulation on plant level product mix a study of epas cluster rule,Not in WOS or Misspelling
686665,does cleanup of hazardous waste sites raise housing values evidence of spatially localized benefits,No citations
333006,plant vintage technology and environmental regulation,No citations
746073,do epa regulations affect labor demand evidence from the pulp and paper industry,No citations
800988,an integrated model of regional and local residential sorting with application to air quality,No citations
300995,jobs versus the environment an industry level perspective,No citations
351268,job creation and persistence in services and manufacturing,No citations
945392,the impact of bank credit on labor reallocation and aggregate industry productivity,No citations
962531,asset allocation in bankruptcy,No citations
884067,finance and growth at the firm level evidence from sba loans,No citations
358554,a multinational perspective on capital structure choice and internal capital markets,No citations
597181,watch what i do not what i say the unintended consequences of the homeland investment act,No citations
795496,capital and labor reallocation within firms,No citations
741276,broad based employee stock ownership motives and outcomes,No citations
219026,asset efficiency and reallocation decisions of bankrupt firms,No citations
289554,the market for corporate assets who engages in mergers and asset sales and are there efficiency gains,No citations
299221,do conglomerate firms allocate resources inefficiently across industries theory and evidence,No citations
470436,the industry life cycle acquisitions and investment does firm organization matter,No citations
699834,private and public merger waves,No citations
660826,on the life cycle dynamics of venture capital and non venture capital financed firms,No citations
310284,effects of corporate diversification on productivity,No citations
345366,"diversification discount """"or"""" premium new evidence from the business information tracking series",No citations
485471,the real determinants of asset sales,No citations
923528,product market characteristics and the choice between ipos and acquisitions,No citations
918538,the option to quit the effect of employee stock options on turnover,No citations
971116,bankruptcy spillovers,No citations
600895,ipo waves product market competition and the going public decision theory and evidence,No citations
925839,flexible prices and leverage,No citations
365242,the costs of shared ownership evidence from international joint ventures,No citations
480348,capital structure with risky foreign investment,No citations
880296,the us listing gap,No citations
959123,the cross section of labor leverage and equity returns,No citations
850022,taxes and leverage at multinational corporations,No citations
451943,why do firms hold so much cash a tax based explanation,No citations
984260,the effect of repatriation tax costs on us multinational investment,No citations
524197,democratizing entry banking deregulations financing constraints and entrepreneurship,No citations
686728,productivity restructuring and the gains from takeovers,No citations
105290,the effects of leveraged buyouts on productivity and related aspects of firm behavior,No citations
607477,post merger restructuring and the boundaries of the firm,No citations
729833,crises and confidence systemic banking crises and depositor behavior,No citations
736101,who works for startups the relation between firm age employee age and growth,No citations
782744,female leadership and gender equity evidence from plant closure,No citations
825225,the long term impacts of medicaid exposure in early childhood evidence from the programs origin,No citations
984276,local food prices snap purchasing power and child health,No citations
634070,the medical care costs of obesity an instrumental variables approach,No citations
491262,has public health insurance for older children reduced disparities in access to care and health outcomes,No citations
614911,school quality and the education health relationship evidence from blacks in segregated schools,No citations
917078,do medical marijuana laws reduce addictions and deaths related to pain killers,No citations
447972,do food stamps cause obesity evidence from immigrant experience,No citations
383936,the demand for dependent health insurance how important is the cost of family coverage,No citations
976866,disease outbreaks healthcare utilization and on time immunization in the first year of life,No citations
374450,an empirical investigation of the determinants of street homelessness,No citations
729921,do housing choice voucher holders live near good schools,No citations
982741,has falling crime invited gentrification,No citations
475083,location location location the 3l approach to house price determination,No citations
465338,intergenerational economic mobility in the united states 1940 to 2000,No citations
855380,"saying ""i dont"" the effect of the affordable care act young adult provision on marriage",Not in WOS or Misspelling
103018,new data bases in human resources  the characteristics of business owners data base,Not in WOS or Misspelling
166027,gender segregation in small firms,No citations
378901,relative deprivation poor health habits and mortality,No citations
645342,revising our thinking about the relationship between maternal labor supply and preschool,No citations
297933,market forces and sex discrimination,No citations
508132,partially identifying treatment effects with an application to covering the uninsured,No citations
275653,are children worse off evaluating well being using a new (and improved) measure of poverty,No citations
844463,saving teens using a policy discontinuity to estimate the effects of medicaid eligibility,No citations
976273,the long term effects of early life medicaid coverage,No citations
962027,the effects of aggregate and gender specific labor demand shocks on child health,No citations
297935,racial matching among african american and hispanic physicians and patients,No citations
563515,are college graduates more responsive to distant labor market opportunities,No citations
597232,learning by doing and market structure,No citations
792167,change at the checkout tracing the impact of a process innovation,No citations
789183,cross sectoral variation in the volatility of plant level idiosyncratic shocks,No citations
454050,advances in logistics and the growth of intra firm trade the case of canadian affiliates of us multinationals 1984 1995,No citations
213980,environmental regulation investment timing and technology choice,No citations
445299,prices spatial competition and heterogeneous producers an empirical test,No citations
489402,trade in high tech services,No citations
897618,managing valuable knowledge in weak ip protection countries,No citations
841170,the impact of information and communication technology adoption on multinational firm boundary decisions,No citations
257484,do world product mandates really matter,No citations
897619,patent protection and the composition of multinational activity evidence from us multinational firms,No citations
195359,exporters skill upgrading and the wage gap,No citations
230336,"exceptional exporter performance cause effect """"or"""" both",No citations
398255,survival of the best fit exposure to low wage countries and the (uneven) growth of us manufacturing plants,No citations
679367,are all trade protection policies created equal empirical evidence for nonequivalent market power effects of tariffs and quotas,No citations
588992,does intellectual property rights reform spur industrial development,No citations
984240,diversification cost structure and the risk premium of multinational corporations,No citations
965318,the tradability of services geographic concentration and trade costs,No citations
697088,product and process productivity implications for quality choice and conditional exporter premia,No citations
792190,export prices of us firms,No citations
653160,exports borders distance and plant size,No citations
844528,buyer seller relationships in international trade do your neighbors matter,No citations
823395,importing exporting and firm level employment volatility,No citations
908681,pirates treasure,No citations
855435,tariff pass through firm heterogeneity and product quality,No citations
887301,domestic gains from offshoring evidence from taa linked us microdata,No citations
645403,export versus fdi and the communication of complex information,No citations
614962,plant level responses to anti dumping duties evidence from us manufacturers,Not in WOS or Misspelling
943621,investment responses to trade liberalization evidence from us industries and establishments,No citations
823388,intra firm trade and vertical fragmentation in us multinational corporations,Not in WOS or Misspelling
552438,the effects of offshoring on the elasticity of labor demand,No citations
516137,firm heterogeneity and the structure of us multinational activity,No citations
754190,there will be exports and licensing the effects of patent rights and innovation on firm sales,No citations
984212,earnings inequality and mobility trends in the united states nationally representative estimates from longitudinally linked employeremployee data,Not in WOS or Misspelling
690333,exploring differences in employment between household and establishment data,No citations
973157,local labor markets in canada and the united states,No citations
834838,its where you work increases in the dispersion of earnings across establishments and individuals in the united states,Not in WOS or Misspelling
984209,augmenting the human capital earnings equation with measures of where people work,No citations
984216,new evidence on sex segregation and sex differences in wages from matched employee employer data,No citations
212026,inter firm segregation and the black/white wage gap,Not in WOS or Misspelling
301126,nondiscrimination rules and the distribution of fringe benefits,No citations
87702,plant turnover and gross employment flows in the us manufacturing sector,No citations
984217,wage and productivity dispersion in united states manufacturing the role of computer investment,No citations
440553,why are black owned businesses less successful than white owned businesses the role of families inheritances and business human capital,No citations
542903,preschoolers enrolled and mothers at work the effects of universal prekindergarten,No citations
825259,"reallocation in the great recession cleansing """"or"""" not",No citations
690324,wage premia in employment clusters how important is worker heterogeneity,No citations
984213,who moves up the job ladder,No citations
234797,wages productivity and worker characteristics evidence from plant level production functions and wage equations,No citations
610222,neighbors and coworkers the importance of residential labor market networks,No citations
175662,managerial tenure business age and small business turnover,No citations
984210,firm performance and the volatility of worker earnings,No citations
792217,skilled immigration and the employment structures of us firms,No citations
780867,job referral networks and the determination of earnings in local labor markets,No citations
754207,do as the neighbors do examining the effect of residential neighborhoods on labor market outcomes,No citations
841199,disconnected geography a spatial analysis of disconnected youth in the united states,No citations
534257,older workers access to employer sponsored retiree health insurance 2000 2006,No citations
959141,differences in self employment duration by year of entry and pre entry wage sector attachment,No citations
632740,changes in firm pension policy trends away from traditional defined benefit plans,No citations
657932,workers unions and takeovers,No citations
119664,the relationships among acquiring and acquired firms product lines,No citations
984286,debtor protection and business dynamism,No citations
89093,firm entry and post entry performance in the us chemical industries,Not in WOS or Misspelling
435720,managerial leverage is limited by the extent of the market hierarchies specialization and the utilization of lawyers human capital,No citations
103064,the effect of ownership changes on the employment and wages of central office and other personnel,No citations
119665,the extent and nature of establishment level diversification in sixteen us manufacturing industries,Not in WOS or Misspelling
184823,the dynamic adjustment process of firm entry and exit in manufacturing and finance insurance and real estate,No citations
521630,specialization firms and markets the division of labor within and between law firms,No citations
852743,the returns to knowledge hierarchies,No citations
922285,older and slower the startup deficits lasting effects on aggregate productivity growth,No citations
409669,trade costs firms and productivity,No citations
315477,learning by doing and aggregate fluctuations,No citations
286691,sectoral job creation and destruction responses to oil price changes,No citations
632760,labor market flows in the cross section and over time,No citations
852827,the rise and fall of unions in the united states,No citations
405264,capital reallocation and liquidity,No citations
454151,"new """"or"""" used investment with credit constraints",No citations
959152,trading down and the business cycle,No citations
971209,heads i win tails you lose asymmetric taxes risk taking and innovation,No citations
962059,local labor demand and program participation dynamics evidence from new york snap administrative records,No citations
346749,the impact of state enterprise zones on urban manufacturing establishments,No citations
